description,category
subscription Starbucks workking lunch,Food & Dining
cloud bill at Dropbox recurring,Software
feb airport ride invoice,Transportation
subscription atlas hub taxi ride,Transportation
train ticket to meeting batch YA1W3R,Transportation
Lighthouse Market gas fill up client visit,Transportation
mar it support invoice,Professional Services
Riverstone accessories desk refund jun Systems,Office Supplies
invoice for utility payment may,Utilities
Atlas Hub - office snacks - ref GMP9A9UR,Food & Dining
compliance advisor - accounting svcs - ref ETW70C6,Professional Services
FOR TEAM MEETING BREAKFAST MEETING FROM RIVERSTONE HUB,Food & Dining
ONLINE PAYMENT FOR PRODUCTIVITY APP MAR,Software
WAREHOUSE RENT AT COMMERCIAL LEASE INVOICE,Rent
DEPOSIT RECEIVED CUSTOMER AT REFUND,Income
working lunch at solid oak llc recurring,Food & Dining
pos apr for refreshments,Food & Dining
store at pickup invoice IKEA,Shopping
atlas media social ads co promo launch,Marketing
rental car business travel inv Z764HS,Transportation
CRM software workspace billing inv AQVFWD,Software
launch promo social media ads from clearview llc,Marketing
Target Furniture Sep Ach,Shopping
internet entry mobile manual carrier at service,Utilities
parking garage invoice late pickup,Transportation
catering coffee at shop ACH order,Food & Dining
Uber - Train Ticket - Order D3W6Q,Transportation
financial advisro payroll service professional fee,Professional Services
affiliate network - commission earned - card 729040,Income
subs revenue settlement batch order 248418,Income
financial advisor online payment project invoice,Professional Services
manual entry silverline market accounting services,Professional Services
POS summit partners gas fill up,Transportation
evergreen llc subs monthly office bill,Utilities
feb refreshments pos,Food & Dining
Sub For Cleaniing Supplies Nov,Office Supplies
mar storage unit rent invoice,Rent
TAXI SERVICE TRAIN TICKET CLIENT VISIT,Transportation
customer subscription revenue mar card purchase,Income
card purhase supplies general,Shopping
invoice clearview charge sysems hosting,Software
restaurant for meeting refreshments team,Food & Dining
apr cleaning supplies refund,Office Supplies
advisor fee at brightline svcs recurring,Professional Services
rfeund payout from marketplace sale,Income
product sale client payment order BFFP1,Income
service from bill broadband co metro period,Utilities
METRO 919881 GROUP - printing card - flyer,Marketing
Solid Oak Solutions - electric bill - txn NFLUO6P,Utilities
Inoice For Gas Fill Up Nov,Transportation
tarnsfer to legal consultant,Professional Services
Summit Partners Catering Order For Team Meeting,Food & Dining
Bank Payroll Card For Apr Service,Professional Services
train ticket airport trip card 2GLXV8QI,Transportation
sep service revenue invoice,Income
subscription for furniture may,Shopping
Bank Card For Taxi Ride May,Transportation
to meeting train ticket from ATLAS CO,Transportation
Retail Purchase At Local Store Manual Entry,Shopping
RENTAL PROPERTY FACILITY RENT NOV INVOICE,Rent
Summit Llc license team plan monthly,Software
stripe payout service revenue oct manual entry,Income
utiliity payment at sewer utility online payment,Utilities
recurring for bulk order dec,Shopping
trade show content marketing nov transfer,Marketing
Adobe - software subscription - order 436781,Software
may product sale ACH,Income
REDWOOD CO purchase run quick card,Shopping
invoice for brand design nov,Marketing
UTILITY PAYMENT METERED USAGE AUTH 127453,Utilities
Paid Promotion Monthly Ad Spend Card 704707,Marketing
NORTHSTAR GROUP recurring duringg travel day,Food & Dining
METRO MILESTONE PAYMENT PAYMENT CLIENT LLC PROJECT,Income
apr compliance review mobile pay,Professional Services
online payment DoorDash working luunch,Food & Dining
client dinner at EVERGREEN svc card purchase,Food & Dining
airport parking gas fill up oct ACH,Transportation
Airport Parking Mobile Pay To Meeting,Transportation
consulting paid inv EG35C4 income order,Income
apr refreshments ACH,Food & Dining
Slack usage license cloud team,Software
Bulk Order Stock Up Batch 53126,Shopping
SUMMIT SYSTEMS - IT SUPPORT - ORDER BWR92N,Professional Services
Northstar late pickup mobile Co pay,Transportation
subs redwood llc monthly retainer income,Income
NOV IT SPPORT ACH,Professional Services
online order at marketplace seller manual entry,Shopping
warehouse owner manual entry space rental,Rent
client commmute at Uber invoice,Transportation
brand design audience test inv CS4F7NI,Marketing
gas utility charge monthly office bill batch y3n0m,Utilities
EMAIL MARKETING AT RIVERRSTONE SOLUTIONS ACH,Marketing
BROADBAND FEE INCLUDED CARD BILL LATE 879569,Utilities
SUBSCRIPTION FOR FACILITY RENT SEP,Rent
Transfer From Cutomer Account,Income
Home Depott Refund Client Materials,Shopping
may desk accessories refund,Office Supplies
ACH stand apr monitor for,Office Supplies
Feb Trash Pickup Ach,Utilities
apr printer paper transfer,Office Supplies
jun printer paper pos,Office Supplies
apr monthly retainer income mobile pay,Income
consulting online paymt riverstone at solutions income,Income
parking garage - taxi ride - order 9657,Transportation
service period service charge from power service,Utilities
ads recurring northstar services campaign at,Marketing
with client coffee from DoorDash,Food & Dining
Target electronics clientt materials,Shopping
transfer for internet service jan,Utilities
Figma desiggn tool dec subscription,Software
dec electric bill POS,Utilities
restaurant mobile pay with client,Food & Dining
internet service automatic debit inv 866130,Utilities
INSTAGRAM POS RETARGETING,Marketing
power service - internet service - auth 791533,Utilities
mobile pay for clieent dinner jan,Food & Dining
bulk order client materials txn 653878,Shopping
Ink Chairs Mobile Pay Office Warehouse Oct,Office Supplies
invvoice for IT support jun,Professional Services
feb toll payment card purchase,Transportation
commission earned at parrtner ACH,Income
LinkedIn Ads PPC campgn feb invoice,Marketing
grabbed client for meeting coffee,Food & Dining
recurring bakery coffee,Food & Dining
stationery - ink cartridges - order zrw1 shop,Office Supplies
manual entry for paid promotion oct,Marketing
DURING TRAVEL DAY OFFICE SNACKS FROM SILVERLINE GROUP,Food & Dining
paper vendor recurring offic restock,Office Supplies
rent paymment monthly pmt card X53L,Rent
CARD PURCHASE FOR PROJECT MILESTONE PAYMT JUN,Income
trade invoice sponsored show post,Marketing
gas fill up business travel inv JKAZ,Transportation
transfer for it support may,Professional Services
onlinee payment replacement for parts,Shopping
MANUAL ENTRY FREELANCE DESINGER DESIGN INVOICE,Professional Services
invoice for phone jan plan,Utilities
ACH LIGHTHOUSE SERVICES storage unit rent,Rent
financial consultting fee advisor professional fee,Professional Services
Silverline Solutions Bulk Order Small Equipment,Shopping
Microsoft 365 SaaS renewal mar card purchase,Software
transfer for sponsored post,Marketing
TRASH PICKUP MONTHLY OFFICE BILL REF CQZJ,Utilities
invoice for advisoory review,Professional Services
card admin purchase supply,Office Supplies
Studio - C5Fj - Warehouse Rent Landlord Inv,Rent
Cloud Usage License Redwood Team From Partners,Software
EVERGREEN NOV OFFICE LLC RENT INV,Rent
grabbed for coffee meeeting client,Food & Dining
commercial space april payment card W0GX,Rent
oct SaaS renewal POS,Software
supply cabinet cleaning supplies from Redwood Hub,Office Supplies
Cobalt Solutions - Airport Ride - Batch 681150,Transportation
WEB DEVELOPER - CONSULTING FEE - CARD 892904,Professional Services
Toll Authority Client Commute Nov Ach,Transportation
refund LIGHTHOUSE HUB cloud bill,Software
train ticket at northstar llc manual entry,Transportation
power service service charge service period,Utilities
front supplier refill printer from desk toner,Office Supplies
refund for gas utility charge dec,Utilities
card purchase office depot toner refill,Office Supplies
deposit clientt subscription at received,Income
ACH FOR DESIGN INVOICE NOV,Professional Services
service revenue client payment card 54419,Income
invvoice for printer paper feb,Office Supplies
AWS MANUAL ENTRRY TEAM UPGRADE,Software
atlas systems ink cartridges oct transfer,Office Supplies
jan monthly retainer income manual entry,Income
freelance - txn fn3hk2 designer preparation tax -,Professional Services
ink at recurring supplier equipment cartridges,Office Supplies
brand design monthly ad spend batch 349676,Marketing
flyer printing at Silverline Solutions sub,Marketing
Sep Gas Fill Up Recurring,Transportation
EVERGREEN PARTNERS subscription space rental,Rent
online payment promotion paid RIVERSTONE CO,Marketing
REDWOOD CO - misc supplies - txn 2FA3,Shopping
nov ticket ach train,Transportation
feb catering order card purchase,Food & Dining
BLUEBIRD PARTNERS advisor fee feb transfer,Professional Services
client 645259 dinner staff event card,Food & Dining
manual entry bluebird market printer paper,Office Supplies
METRO MAR CARD BANK CATERING MARKET ORDER,Food & Dining
april pmt montly lease from BLUEBIRD SERVICES,Rent
Service Riverstone At Transfer Charge Solutions,Utilities
ach atlas co office rent,Rent
april paymt facility rent from business center,Rent
Uber Eats catering order late meeting,Food & Dining
recurring linkedin ads ads campgn,Marketing
printer paper and ink,Office Supplies
Starbucks coffee with client,Food & Dining
store Amazon pickup POS at,Shopping
invoice BRIGHTLIEN SERVICES team license,Software
Mo Ad Spend Content Marketing From Meta,Marketing
POS for prodctivity app jun,Software
transfer web developer compliance review,Professional Services
AMAZON 165686 RETAIL PURCHASE AUTH - -,Shopping
Recurring For Consulting Incme Nov,Income
jun parking fee recurring,Transportation
may desk accessories recurring,Office Supplies
jan storage unit rent invoice,Rent
sponsor sub incoming transfer,Income
Hr Payment Consultant Professional Fee Online,Professional Services
project milestone payment revenue deposit txn KH38JB,Income
SPONSORED POST ADS CAMPAIGN FROM SEO AGENCY,Marketing
subscription revenue at customer ACH,Income
transfer for oct design invoice,Professional Services
cleaning supplies front desk batch 84424,Office Supplies
tax preparation at payroll provier POS,Professional Services
sep consulting icome subscription,Income
print shop PPC capmgn jan manual entry,Marketing
feb content marketing recurring,Marketing
financial consultation legal sep inovice advisor,Professional Services
client paymt received inv,Income
Commission Earned Customer Paid Order E2Ayp,Income
Staples Subscription Admin Area,Office Supplies
paid invoice SUMMIT payment milestone HUB project from,Income
Ach Pizza Place Office Snacks,Food & Dining
pizza place - coffee - card awlg,Food & Dining
phone company - phone plan - ref 5rvmk,Utilities
lighthouse llc refund suite charge,Rent
catering dinner staff client event company,Food & Dining
April Payment Facility Rent From Studio Landlord,Rent
REFUND BUSINESS ADVIOR FEE CONSULTANT,Professional Services
taxi ride at evergreen group refudn,Transportation
broadband bill at sewer utility refund,Utilities
GOOGLE ADS MOBILE PAY MONTHLY AD SPEND,Marketing
Office Depot Printer Paaper Office Restock,Office Supplies
Riverstone Co - Software Subscription - Ref Ql2D792,Software
subscription support contract,Professional Services
feb legal consultation bank card,Professional Services
Sponsored Post Ppc Campaign From Solid Oak Group,Marketing
commission earned revenue deposit card WMN9,Income
refreshments at bluebird group subscripiton,Food & Dining
taxi ride at riverstone services manual entry,Transportation
POS for client dinner may,Food & Dining
may payroll service mobile pay,Professional Services
lighthouse group deposit received may mobile pay,Income
online harbor social llc payment ads media,Marketing
working lunch for team meeting auth UJJ3,Food & Dining
Instagram - brand design - inv 966679,Marketing
mar storage unit rent recurring,Rent
metro parts subs hub dec replacement,Shopping
project invoice acocunting services from freelance designer,Professional Services
Cobalt Market - developer tool - ref 978529,Software
metro hub recurring cloud usage,Software
evergreen services - gas fill up - ref 4EPBO017,Transportation
TEAM LUNCH AT SUMMIT CO POS,Food & Dining
bluebird solutions card taxi ride bank apr,Transportation
Catering At Order Doordash Invoice,Food & Dining
BULK ORDER AUTH PURCHASE W4OQ0PFR GENERAL,Shopping
Sponsored Post Email Marketing From Clearview Systems,Marketing
apr email marketig manual entry,Marketing
STORE AUTH QUICK IJIYS2N PICKUP RUN,Shopping
ACH license team Vercel,Software
Uber taxi ride feb recurring,Transportation
ach revenue for feb subscription,Income
atlas hub toll pmt late pickup,Transportation
cloud usage developer tool from RIVERSTONE HUB,Software
team license pro account order 35553,Software
Subscription For Hosting Charge Apr,Software
internet account payment service inv 500374,Utilities
social at BRIGHTLINE media bank card ads SYSTEMS,Marketing
bank card for clod bill dec,Software
internet provider trash pickup nov mobile pay,Utilities
mobile pay for software subscription nov,Software
recurring for checkout nov,Shopping
payroll provider accounting services mar transfer,Professional Services
gas fill up at taxi service invoice,Transportation
ADS CAMPAIGN AT FACEBOOK ADS ONLINE PAYMENT,Marketing
Online Sets Pmt Team For,Software
monthly lease at CLEARVIEW GROUP recurring,Rent
online store pmt pens desk pencils and,Office Supplies
printer ink papre and,Office Supplies
Cobalt Co - cleaning supplies - card U57JGD5,Office Supplies
Local Cafe Team Lunch Apr Transffer,Food & Dining
Consulting Services Bank At Northstar Card Income,Income
LAUNCH MARKETING META PROMO CONTENT FROM,Marketing
mobile pay partner product sale,Income
Team License Seat Renewal Inv 441867,Software
printer equipment notebooks room supplier from,Office Supplies
studio landlord - warehouse rent - order TX42,Rent
oct manual entry rent office,Rent
Client Card Purchase Revenue Deposit,Income
Ach Mobile Carrier Service Charge,Utilities
may client dinner ACH,Food & Dining
STAFF EVENT OFFICE SNACKS FROM SUBWAY,Food & Dining
subs warehouse commercial owwner space,Rent
target checkout stock up,Shopping
RECURRING FOR PAYROLL SERVICE FEB,Professional Services
Stock Up Retail Purchase From Best Buy,Shopping
invoice property from account,Rent
CLOUD UPGRADE TEAM INV 5J3SPS BILL,Software
oct electric bill online pmt,Utilities
april payment storage unit rent from rental property,Rent
invoice business consultant accounting svc,Professional Services
Atlas Systems - Legal Consultation - Ref Iwgbo02,Professional Services
QUICK RUN ONLINE ODER FROM ETSY,Shopping
cloud usage hosting charge from redwood co,Software
pizza place office snacks during travel day,Food & Dining
SERVICE REVENUE REVENUE DEPOSIT BATCH 206679,Income
Vercel Hosting Charge Renewal Seat,Software
mobile pay for catering order dec,Food & Dining
desk store - notebooks - card 398579,Office Supplies
sponsorship platform - email marketing - order SWHYHW,Marketing
subscription for productivity app jun,Software
payroll service at freelance designer POS,Professional Services
monthly lease april payment order 4XQFKXM9,Rent
studio landlord bank card space renal,Rent
ATLAS PERIOD SOLUTIONS TRANSFER SERVICE,Utilities
SILVERLINE HUB card purchase airport trip,Transportation
staff from ink ink cartridges warehouse supplies,Office Supplies
CLIENT ENTRY AIRPORT COMMUTE AT MANUAL PARKING,Transportation
suite center from coworking charge business rent,Rent
recurring for trash dec pickup,Utilities
bank card for chairs may office,Office Supplies
rental car at bluebird group transfer,Transportation
storage facility storage unit rent due today,Rent
PARRKING FEE AT SHELL INVOICE,Transportation
atlas late fee included bill electric market,Utilities
parking space owner facility rent feb online payment,Rent
jan team lunch refund,Food & Dining
refund utility from provider,Utilities
Summit Group Card Purchase Revenue Deposit,Income
Brightline Hub onlline pmt business travel,Transportation
Nov Invice Sale Product,Income
IT contract support refund support,Professional Services
airport parking gas fill up downtown,Transportation
advisor fee expert review inv P6UHW,Professional Services
Sub Nov Toner Refill For,Office Supplies
Catering Company Refund After Sales Call,Food & Dining
Legal Consultation Expert Review Txn 59033,Professional Services
Refund From Order Marketplace,Shopping
train station taxi ride late pickup,Transportation
FURNITURE UP CARD 878340 STOCK,Shopping
COBALT SERVICES - water bill - ref 74015,Utilities
recurring restaurant catering order,Food & Dining
front Services toner refill desk from Harbor,Office Supplies
summit solutions accounting services client project,Professional Services
Stationery Shop Office Chairs Staff Supplies,Office Supplies
Online Payment Cobalt Co Phone Plan,Utilities
BANK TOOL DESIGN CARD APR FOR,Software
desk pos stand nov store monitor,Office Supplies
service period phone plan from gas company,Utilities
invoice it support it support,Professional Services
Riverstone Services Compliance Review Nov Online Payment,Professional Services
refund printer ink paper warehuse,Office Supplies
refund invoice sponsor pmt received,Income
broadband provider - internet service - ref M9Q1ZOD,Utilities
jan developer tool invoice,Software
mar noteboks invoice,Office Supplies
toner store entry manual at desk refill,Office Supplies
home depot online order may recurring,Shopping
mobile pay sale customer product,Income
POS Google Workspace team license,Software
launcch promo content marketing from harbor llc,Marketing
monitor stand at Brightline Partners transfer,Office Supplies
silverline market warehouse rent jan card purchase,Rent
online payment for team seats,Software
cleaning supplier card purchase printeer room,Office Supplies
Silverline Services Ink Cartridges Mar Invoice,Office Supplies
content auth 936386 invoice marketing campgn,Marketing
silverline systems toll paymt sep card purchase,Transportation
Clearview Llc - product sale - order K2VYBRK8,Income
CLEARVIEW HUB ONLINE PAYMT AFTER SALES CALL,Food & Dining
HOME DEPOT BANK CARD CLIENT MATERIALS,Shopping
audiience test brand design from lighthouse services,Marketing
suite charge monthly lease from studio landlord,Rent
Marketplace Seller Misc Supplies Feb Subscription,Shopping
Gas Cobalt Co Utility Charge At Invoice,Utilities
Cobalt online spedn Hub monthly payment ad,Marketing
payroll professional order fee service 576949,Professional Services
Silverline Hub Accounting Svc Nov Pos,Professional Services
Lyft Card Purchase Business Travel,Transportation
Metro Services office chairs supply cabinet,Office Supplies
bank marketing email for card nov,Marketing
Ppc Campaign At Mailchimp Mobile Pay,Marketing
transfer for monthly spac,Rent
Adobe - cloud bill - txn 5098,Software
UBER AIIRPORT RIDE,Transportation
HubSpot marketing test email audience,Marketing
Team License At Dropbox Online Payment,Software
Ebay Furniture Quick Run,Shopping
online payment for email marketing oct,Marketing
Pos Hubspot Ppc Campaign,Marketing
Apr Online Order Invoice,Shopping
staples - office chairs - txn 194916,Office Supplies
clearview hub brand design sep subscription,Marketing
SUBSCRIPTION RIVERSTONE PARTNERS ELECTRIC BILL,Utilities
monthly leasee at property manager bank card,Rent
MOBILE PAY WHOLESALE BUYER MONTHLY RETAINER INCOME,Income
train ticket at parking garage card purchase,Transportation
team license monthly plan txn 438291,Software
manual entry slack saas renewal,Software
apr bus pass ACH,Transportation
monitor stand at Atlas Services POS,Office Supplies
gas included late auth LP2S07JO utility charge fee,Utilities
apr misc supplies ACH,Shopping
Recurring For Monthly Lease May,Rent
consulting income at solid oak systems recurring,Income
evergreen solutions trash pickup automatic debit,Utilities
grabbed meeting coffee for client,Food & Dining
online pmt for subscription revenue oct,Income
SOLID OAK LLC - tax preparation - txn 8921PV,Professional Services
stock from up pickup store target,Shopping
recurring for legall consultation may,Professional Services
traain station - taxi ride - ref MKRY7,Transportation
MISC SUPPLIES AT WALMRT BANK CARD,Shopping
replacement at Target parts recurring,Shopping
mobile pay for refreshments jan,Food & Dining
POS cafe cahrge during airport wait,Food & Dining
BUSINESS TRAVEL PARKING FEE FROM EXXON,Transportation
mobile pay print shop ads campaign,Marketing
Lighthouse Systems invoice client materials,Shopping
Train Jan Manual Toll Payment Station Entry,Transportation
Developer At Aws Tool Ach,Software
eBay recurring stock up,Shopping
Redwood Group flyer printing campaign invoice,Marketing
oct social media ads recurring,Marketing
nov POS supplies cleaning,Office Supplies
consulting fee support contract auth GXWC,Professional Services
Exxon - parking fee - inv 937866,Transportation
deli counter invoice for team meeting,Food & Dining
content marketing at clarview group refund,Marketing
Desk Store - Cleaning Supplies - Batch Sccu4V7R,Office Supplies
may office rent bank card,Rent
Best Buy retail purhcase for office setup,Shopping
Design Tool Team Upgrade Txn 7Zfv0Z,Software
parking garage bank card client visit,Transportation
Mar Crm Software Online Payment,Software
course may platform commission earned sub,Income
apr design tool POS,Software
apr gas utility charge card purchase,Utilities
project preparation Cobalt from invoice Llc tax,Professional Services
ink warehouse mobile pay office restock,Office Supplies
printer - inv printer - 177745 paper supplier,Office Supplies
broadband provider electric bill oct online pmt,Utilities
onilne payment studio landlord office lease,Rent
Northstar Group hossting charge monthly plan,Software
Oct Meal Delivery Transfer,Food & Dining
OCT RENT TRANSFER OFFICE,Rent
OFFICE LEASE AT WAREHOUSE OWNER RECURRING,Rent
Jun Facility Rent Recurring,Rent
oct bulk recurring order,Shopping
QUICKBOOKS RECURRING SEAT RENEWAL,Software
NORTHSTAR SOLUTIONS WAREHOUSE RENT MAR TRANSFER,Rent
online order at SILVERLINE SERVICES ACH,Shopping
taxi service bank card late pickup,Transportation
sep fill gas up card bank,Transportation
Online Payment Atlas Solutions Compliance Review,Professional Services
Bluebird Oct Recurring Office Rent Svc,Rent
PENS AND PENCILS PRINTER ROOM INV 29ET,Office Supplies
POS toner refill notebooks and,Office Supplies
LIGHTHOSUE paid customer transfer SOLUTIONS,Income
Evergreen Partners Income - Txn Monthly Retainer - 5Tkuq,Income
Sillverline Group monthly retainer income dec manual entry,Income
bank card for service charge feb,Utilities
Summit commute may POS Llc client,Transportation
utility payment at power service card purhcase,Utilities
online order at Brightline Partners bank card,Shopping
subscription for service charge may,Utilities
law firm - legal consultation - batch I5W1V,Professional Services
POS for breafast meeting feb,Food & Dining
online payment for store pickup apr,Shopping
suite charge commercial space from coworking space,Rent
Evergreen Solutions license team seat renewal,Software
manual entry Mailchimp email marketing,Marketing
jun hosting charge refund,Software
Harbor Llc ink supply cartridges cabinet,Office Supplies
Exxon client commute dec subscription,Transportation
SOLID OAK SYSTEMS storage unit rent due today,Rent
SMALL EQUIPMENT CHECKOUT FROM EVERGREEN SYSTEMS,Shopping
Law Recurring Project Firm Client,Professional Services
Google Ads - lead generation - card RAVAF,Marketing
Northstar Group professionl fee refund,Professional Services
Officce Lease April Payment,Rent
gas company moblie pay service period,Utilities
RIVERSTONE GROUP - misc supplies - order 515435,Shopping
jun cloud bill manual entry,Software
Uber KWWETUJO - txn order catring Eats -,Food & Dining
Invoice For Printing Flyer Jan,Marketing
power service - service charge - txn t67f2,Utilities
REFUND FROM ORDRE MARKETPLACE,Shopping
bank card clearvieew services monthly lease,Rent
Sewer - Electric 233375 Utility Auth Bill -,Utilities
general purchase online order from local store,Shopping
Zoom - Design Tool - Auth Zvc89Vt,Software
transfer for monthly spce,Rent
STAFF SUPPLIES CLEANING SUPPLIES FROM PRINTER SUPPLIER,Office Supplies
Home Depto replacement oct parts invoice,Shopping
Solid Commissio Jun Mobile Pay Oak Earned Solutions,Income
seo agency - social media ads - card 6292,Marketing
subscription trsah service phone plan,Utilities
Card Purchase For Toll Payment Jan,Transportation
Furniture Outlet - Pens And Pencils - Card 673257,Office Supplies
REFFUND FOR CATERING DEPOSIT,Food & Dining
mar supplies misc ACH,Shopping
Recurring Mar Online For Order,Shopping
transfer rental property facility rent,Rent
traiin station pos airport trip,Transportation
feb office rent transfer,Rent
may cloud bill manual entry,Software
card puchase coffee restaurant,Food & Dining
client commute to meting ref 255685,Transportation
train ticket at Evergreenn Co subscription,Transportation
shell train ticket to meeting,Transportation
SILVERLINE HUB consulting fee professional fee,Professional Services
refund for store pickup feb,Shopping
nov rent pmt transfer,Rent
late place from pizza meeting coffee,Food & Dining
Zoom mobile pay team upgrade,Software
Apr Retail Purchase Online Payment,Shopping
Microsoft 365 - Hosting Charge - Inv 9966,Software
team lunch at Uber Eats mobilee pay,Food & Dining
ACH marketplace seller furniture,Shopping
office lease at business center card purchase,Rent
evergreen team hub pos meeting for,Food & Dining
Google audience test Ads social media ads,Marketing
law firm IT support jun invoiice,Professional Services
Pos Airport Parking Client Commute,Transportation
ONLINE PAYMT FOR WATER BILL MAY,Utilities
electirc bill account payment inv N5WI,Utilities
