description,category
sep client commute manual entry,Transportation
metro market - product sale - batch fmdf,Income
mobile pay for monitor stand apr,Office Supplies
recurring clearrview partners facility rent,Rent
nov service revenue subscription,Income
FEB ACH LEAD GENERRATION,Marketing
EMAIL MARKETING AT GOOGLE ADS BANK CARD,Marketing
monthly aws clud bill,Software
invoice Metro Co office rent,Rent
gas company phone plan automatic debit,Utilities
trash at PARTNERS pickup refund CLEARVIEW,Utilities
harbor solutions ach sponsored post,Marketing
Summit 899632 - team lunch order Group -,Food & Dining
for team order meeting bakery catering from,Food & Dining
invoice account property from,Rent
equippment supplier - ink cartridges - order 670615,Office Supplies
mobile pay sponsorship platform PPC campaign,Marketing
Costco bank card misc supplies jan,Shopping
Office Depot - Cleaning Supplies - Card 6Sf1F,Office Supplies
Payroll Service Professional Fee Txn 430195,Professional Services
Exxon train ticket downtown,Transportation
seweer utility - broadband bill - txn 144576,Utilities
IT support design invoice expert review,Professional Services
rental property bank card monthly pmt,Rent
monthly trash service office bill pickup from power,Utilities
NORTHSTAR SYSTEMS OFFICE LEASE SEP MANUAL ENTRY,Rent
front desk desk accessories from stationery shop,Office Supplies
printer and paper ink,Office Supplies
HR consultant manual entry support contract,Professional Services
Manual Entry Commercial For May Space,Rent
desk store cleaing supplies dec invoice,Office Supplies
office lease monthly payment auth 3884682,Rent
Online Pyamt Monthly Service Bill,Utilities
sub advisor review compliance compliance,Professional Services
refund ink SYSTEMS cartridges HARBOR,Office Supplies
train station train ticket jun transfer,Transportation
electronics at Solid Oak Hub recurring,Shopping
parking spce owner - office rent - auth WOO0,Rent
freelance designer tax preparation may card purchase,Professional Services
POS solid oak services monthly lease,Rent
Consulting Project Fee 280986 Txn Clien,Professional Services
Summit Team Subscription Services Upgrade,Software
card purchase for tax preparation dec,Professional Services
mobile sep for legal pay consultation,Professional Services
mar breakfast meeting invoice,Food & Dining
gas Shell online up paymt fill at,Transportation
slack online payment cloud usage,Software
ink warehouse monitor stand supply cabinet,Office Supplies
late meeting cliennt dinner from local cafe,Food & Dining
law firm - tax preparation - inv AO8Y0H5,Professional Services
property manager monthly lease suite charge,Rent
monthly plan software subscription from lghthouse services,Software
Seo Agency Subscription Camapign Inv,Marketing
Partner Commission Earned May Recurring,Income
bank GROUP ads SUMMIT card campaign,Marketing
online order txn sock XTNS up,Shopping
summit software upgrade hub subscription team,Software
business center warehouse rent dec POS,Rent
Staff Event Coffee From Bakery,Food & Dining
product recurring at sale customer,Income
POS for consulting income mar,Income
jun subscription revenue POS,Income
PAID ADS AT INVOICE LINKEDIN PROMOTION,Marketing
pro fee accounting consultation legal firm from,Professional Services
bank card for breakfast meeting dec,Food & Dining
MOBILE PAY FOR PPC CAMPAIGN MAR,Marketing
mobile pay phone jun plan for,Utilities
Cloud Bill Team Upgrade Txn 527176,Software
invoice for electronics jun,Shopping
MARKTPLACE EQUIPMENT SMALL SELLER ACH,Shopping
property manager warehosue rent oct POS,Rent
monthly aws clod bill,Software
for meal delivery Oak Solid from Group meeting team,Food & Dining
Jun Store Pickup Recurring,Shopping
Transfer For Meal Delivery Jan,Food & Dining
expert review advisor fee from HR consultant,Professional Services
Lighthouse Income Co Card - Monthly 151523 - Retainer,Income
IT support at IT support subscription,Professional Services
mo space 561925 lease rental batch,Rent
HARBOR BULK ORDER PURCHASE GENERAL LLC,Shopping
printeer room toner market refill clearview from,Office Supplies
due today commercial space from warehouse owner,Rent
online payment for replcaement parts,Shopping
studio landlord recurring suite charge,Rent
HARBOR SERVICES parking fee downtown,Transportation
TARGET 717289 TXN - - FURNITURE,Shopping
Solid - txn meal delivery Oak 232707 Llc -,Food & Dining
Audience Test Email Marketing From Meta,Marketing
late fee included utility payment from fiber provider,Utilities
Clearview Services Project Milestone Payment Revenue Deposit,Income
utility payment at northstar services refund,Utilities
for office setup store pickup from bluebird hub,Shopping
NOV BROADBAND BILL POS,Utilities
Sponsored Post Content Marketing From Google Ads,Marketing
local cafe team lunch late meting,Food & Dining
jun utility payment online paaymt,Utilities
Dropbox - design tool - batch T4H8I4,Software
due today rent payment from coworking space,Rent
WATER UTILITY DEBIT ONLINE PAYMENT AUTOMATIC,Utilities
TEAM LICENSE MONTHLY PLAN CARD 21ZZS,Software
office snacks at pizza place card purchase,Food & Dining
refreshments staff event batch x4pzj42,Food & Dining
printer pens and from vendor room paper pencils,Office Supplies
monthly retainer income at affiliate network transfer,Income
METRO STATION TAXI INV - - RIDE YWH8EA32,Transportation
BROADBAND OFFICE BILL MONTHLY CARD BQONVW BILL,Utilities
mobile pay COBALT CO replacement parts,Shopping
water utility - broadbnd bill - ref 442007,Utilities
Electric Company Water Bill Metered Usage,Utilities
Coffee Doordash At Invoice,Food & Dining
Subway coffee nov online payment,Food & Dining
bakery - refreshments - batch 74479,Food & Dining
ACH Evergreen Solutions monthly retainer income,Income
POS for consulting fee mar,Professional Services
mobile pay catering company office snacks,Food & Dining
POS revenue service marketplace payout,Income
apr refresments subscription,Food & Dining
oct entry product sale manual,Income
BUS TRAVEL PASS BUSINESS EVSTYGX CARD,Transportation
Mailchimp retargeting media ads social,Marketing
Brightline Co onlinee paymt april payment,Rent
Transfer Facility Harbor Co Rent,Rent
manual entry electric company trash pickup,Utilities
Pro Account Design Tool From Bluebird Parrtners,Software
train station - taxi ride - card 528981,Transportation
course platform recurring customer paid,Income
client invoce payment received,Income
Slack design tool sep refund,Software
invoice for electric bill mar,Utilities
harbor chare - card service llc TGVXKQ -,Utilities
mobile pay for developer tool oct,Software
dec internet service transfer,Utilities
ZOOM CRM SOFTWARE MONTHLY PLAN,Software
Studio S4Vuva1S Inv Lease - - Landlord Monthly,Rent
Consulting Order Paid Invoice Income 34Ngdu,Income
deli counter team lunch with client,Food & Dining
cleaning supplies at stationery shop recurring,Office Supplies
refund toll authority airport ride,Transportation
transfer desk store desk accessories,Office Supplies
printer paper at cleaning supplier online payment,Office Supplies
Northstar Partners invoice monthly plan,Software
desk store - desk accessories - inv 957625,Office Supplies
lease office business lease invoice from center,Rent
PARKING FEE AT LYFT ACH,Transportation
etsy client electronics materials,Shopping
grabbde coffee for client meeting,Food & Dining
suite management manual entry april payment,Rent
STUDIO SUITE LANDLORD CHARGE POS,Rent
bank app productivity metro llc card,Software
ach dinner nov client for,Food & Dining
transfer to legal consultatn,Professional Services
Hosting Charge Seat Renewal Card D9Qdakg,Software
DEC INCOME REFUND CONSULTINGG,Income
Manual Entry For Compliance Review Jan,Professional Services
april payment warehouse rent from office landllord,Rent
payroll porvider legal consultation mar refund,Professional Services
refreshments staff 73058 event txn,Food & Dining
gas utility charge automatic debit auth 3d3sc,Utilities
BRIGHTLNIE SOLUTIONS - client dinner - txn 664360,Food & Dining
office landlord office lease nov online payment,Rent
Printer Systems Room Metro Monitor Stand From,Office Supplies
subscription Shll rental car,Transportation
with client team lunc from coffee shop,Food & Dining
Ach For Misc Supplie Feb,Shopping
riverstone SaaS renewal batch - - systems 591153,Software
lighthouse llc online payment late pickup,Transportation
expert review design invice from web developer,Professional Services
online payment gas company internet service,Utilities
Phone Plan At Electric Company Card Purchase,Utilities
metered usage pohne plan from riverstone services,Utilities
INTERNET SERVICE AT SEWWER UTILITY SUBSCRIPTION,Utilities
supply cabinet cleanig supplies from paper vendor,Office Supplies
MONTHLY PLAN HOSTING CHARGE FROM FIGMA,Software
Uber Parikng Fee Airport Trip,Transportation
Metro Group - Gas Fill Up - Card Fw9Ioy,Transportation
may retail purchase transfer,Shopping
Walmart electronics sep subs,Shopping
CLEARVIEW CO WAREHOUSE RENT MAR RECURRING,Rent
Coffee At Cobalt Co Card Purchase,Food & Dining
Starbucks team lunch oct subscription,Food & Dining
mobile oct pay invoice for design,Professional Services
Walmart - checkout - batch 362822,Shopping
ACH for content marketing jun,Marketing
Atlas Llc - Design Tool - Ref Soh7Qll,Software
PRODUCT SALE INCOMING TRANSFER ORER 7O7D,Income
Bluebird Hub Manual Entry Professional Fee,Professional Services
Legal Consultaation Client Project Txn Byfzv130,Professional Services
developer tool cloud usage auth JJ4606,Software
electric bill batch office bill monthly 540853,Utilities
With Client Office Snacks From Redwood Hub,Food & Dining
saas renewal at slacck transfer,Software
tranfser for monthly space,Rent
Shell bank card downtown,Transportation
Transfer Business Center Warehouse Rent,Rent
NORRTHSTAR GROUP refund retargeting,Marketing
bakkery team lunch sep recurring,Food & Dining
may productivity app recurring,Software
REDWOOD materials pickup store client CO,Shopping
social media ads at SEO agency manual entry,Marketing
Slack Team License Nov Moible Pay,Software
brand design sponsored post card IE40Q8XT,Marketing
sponsorship platform lead generation launch promo,Marketing
Refund Marketplace From Order,Shopping
online order client materials ref 757445,Shopping
STAFF EVENT WORKING LUNCH FROM CATERING COMPANY,Food & Dining
POS group client dinner atlas,Food & Dining
launch promo ads campaign from Meta,Marketing
transfer evergreen llc office chairs,Office Supplies
Ink Cartridges At Solid Oak Llc Online Payment,Office Supplies
card purchase evergreen market accounting svcs,Professional Services
Northstar Systems furniture apr invoice,Shopping
sub support cotnract,Professional Services
Subscription Ink Warehouse Ink Cartridges,Office Supplies
paper vendor office chairs sep online payment,Office Supplies
Walmart card jan purchase purchase retail,Shopping
GOOGLE WORKSPACE INV PRO ACCOUNT,Software
payroll service project invoice order sfkrg76,Professional Services
PROJECT INVOICE PAYROLL SERVICE FROM COMPLIANCE ADVISOR,Professional Services
payroll 93965 service client ref project,Professional Services
affiliate - - JJOR network rceived payment invoice auth,Income
dec client dinner subscription,Food & Dining
team lunch 92322 late inv meeting,Food & Dining
notebooks 595841 admin inv area,Office Supplies
stripe payout ACH revenue deposit,Income
METRO SERVICES brand design monthly ad spend,Marketing
PAYROLL SERVICE AT WEB DEVELOPER RECURRING,Professional Services
phone plan automatic debit inv 6C4W713,Utilities
Notion transfer monthly plan,Software
harbor solutionss catering order after sales call,Food & Dining
jan water bill transfer,Utilities
pizza place - refreshments - batch 370535,Food & Dining
SUMMIT PARTNERS ONLINE NOV PAYMENT TAX PREPARATION,Professional Services
rental car to meeting txn 948952,Transportation
VERCEL TEAM LICENSE NOV ACH,Software
airport trip rental car from Clearview Llc,Transportation
clearview group lead generation mar card purchase,Marketing
Online Payment Metro Partners Consulting Fee,Professional Services
Audience Test Social Media Ads From Sponsorship Platform,Marketing
financial advisor invoice fee professional,Professional Services
nov campaign transfer ads,Marketing
Pizzaa Place Meeting Team For Refund,Food & Dining
ACH CO lead COBALT generation,Marketing
jan legal consultation subscription,Professional Services
pens and pecils at Brightline Solutions mobile pay,Office Supplies
admin area desk accessories from equipment supplier,Office Supplies
Accounting Consultation - - Legal Inv Firm 987427,Professional Services
online payment for trash pickup apr,Utilities
during travel day meal delivery from Suway,Food & Dining
Online Pmt Sponsor Invoice Payment Received,Income
Legal Consultation Client Project Batch 108065,Professional Services
expert review it support from web developer,Professional Services
Dec Office Rent Mobile Pay,Rent
recurring Cobatl Llc monthly lease,Rent
storage unit rent lease invoice batch XAHFDTW,Rent
apr misc spply mobile pay,Shopping
train meeting ticket 484376 to auth,Transportation
financial advisor tax preparation support contract,Professional Services
clearview - awsqp charge hub card - hostnig,Software
RIVERSTONE CHARGE RENT GROUP SUITE WAREHOUSE,Rent
broadband provider internet service nov transfer,Utilities
subscription for trash pickup jan,Utilities
Staples ACH staff supplies,Office Supplies
Metro Svcs Client Pos With,Food & Dining
seat renewal developer tool from Google Workspace,Software
Doordash Online Payment For Team Meeting,Food & Dining
Online Paymt Pizza Place Team Lunch,Food & Dining
ACH for sale product jun,Income
paid revenue from retainer service invoice client,Income
misc supplies at target transfer,Shopping
onlline pmt monthly service bill,Utilities
rental car at Redwood Co online payment,Transportation
toll payment at toll authority recurring,Transportation
client commute business travel inv 278837,Transportation
bluebird - charge gas solutions utilityy dwh7 - ref,Utilities
feb lease monthly pos,Rent
feb airport ride card purchase,Transportation
sep water bill online pmt,Utilities
dropbox - clud bill - card 424515,Software
mobiile pay web developer consulting fee,Professional Services
feb purchase card fee consulting,Professional Services
MOBILE CARRIER - BROADBAND BILL - BATCH VGGB,Utilities
amazoon card purchase misc supplies feb,Shopping
office svcs from accessories Bluebird desk restock,Office Supplies
seat from team license Co Harbor renewal,Software
transfer Notion cloud bill,Software
Lighthouse Partners Retail Purchase Feb Online Payment,Shopping
COMPLIANCE REVIIEW TXN 872259 REVIEW EXPERT,Professional Services
silverline market rental space sub,Rent
replacement parts client materials card 749244,Shopping
jun gas utility chrge ACH,Utilities
Ach Atlas Group Toll Paymt,Transportation
redwood partners store pickup oct transfer,Shopping
tax 403066 client project preparation card,Professional Services
service period service charge from gas company,Utilities
pos summit partners pens and pencils,Office Supplies
Staples desk accessories jan recurring,Office Supplies
Invoice Broadband Bill Co Summit,Utilities
Sub For Bulk Order May,Shopping
online bill service montlhy payment,Utilities
IT support at Clearview Solutoins card purchase,Professional Services
stationery shop printer paepr jan bank card,Office Supplies
Atlas Llc - online order - batch WDC112,Shopping
transfer for trashh pickup jan,Utilities
Web Developer Recurring Client Project,Professional Services
manual Redwood trash pickup Partners entry,Utilities
paid promotion audience test order KJE4IWUY,Marketing
catering sep subscription working company lunch,Food & Dining
hosting charge team ref 82739 upgrade,Software
monthly compliance harbor partners review from retainer,Professional Services
Invoice Payment Received At Wholesale Buyer Mobile Pay,Income
METERED USAGE BROADBAND BILL FROM COBALT MARKET,Utilities
bulk stock card up order 9y80pfs,Shopping
silverline services - office snacks - batch 6KJ7,Food & Dining
offiec landlord - warehouse rent - order 6KE3,Rent
Uber Snacks Eats Client With Office,Food & Dining
Evergreen Group - water bill - order GJNGVSPJ,Utilities
metro hub - social media ads - batch P3WICY,Marketing
Slack cloud bill workspace billing,Software
consulting income incoming transfer order OD1CT,Income
broadband provider POS service period,Utilities
Target inv order 733187 - bulk -,Shopping
Stripe Payout - Commission Earned - Batch 777522,Income
HARBOR LLC - BREAKFAST MEETING - INV TP1NA,Food & Dining
refreshments inv event staff 125775,Food & Dining
dropbox subscription software oct pay mobile,Software
transfer Home Depot bulk order,Shopping
general furniture purchase Depot Home from,Shopping
due today rent payment from riverstone co,Rent
invoice client retainer recurring payment at received,Income
may furniture subs,Shopping
locall store replacement parts quick run,Shopping
space rental monthly lease from coworking space,Rent
transfer for mo space,Rent
revenue deposit project milestone payment from invoice portal,Income
evergreen campaign servicees - ppc bwj695 batch -,Marketing
sep commission earned recurring,Income
invoice SUMMIT furniture PARTNERS,Shopping
jan service charge transfre,Utilities
Instagram online payment retargeting,Marketing
ACH for office lease jun,Rent
jun rnetal car ACH,Transportation
LinkedIn Ads flyer printing sponsored post,Marketing
dec bulk card purchase order,Shopping
ELECTRIC BILL AT PHONE COMPANY POS,Utilities
Card Purchase For Productivity App Apr,Software
silverline ride visit airport client group,Transportation
metro station manual entry airport trip,Transportation
Atlas Partners Parking Fee To Meeting,Transportation
accounting services at northstar services ACH,Professional Services
service revenue at EVERGREEN LLC POS,Income
warehouse rent space rental auth 564874,Rent
Subway refreshments mar refund,Food & Dining
POS SEO agency paid promotion,Marketing
DoorDash transfer staff event,Food & Dining
Kitchen Supply Store - Notebooks - Ref 302716,Office Supplies
Harbor Co Client Dinner For Team Meeting,Food & Dining
transfer account to toll,Transportation
REFUND PARTNERS CHAIRS SILVERLINE OFFICE,Office Supplies
Incoming Transfer Product Sale From Stripe Payout,Income
MAR NOTEBOOKS CARD PURCHASE,Office Supplies
quickbooks design tool workspace billing,Software
stock up electronics from marketplace seller,Shopping
cloud usage from software northstar systems subscription,Software
depositt received customer paid ref 121926,Income
taxi txn - service airport SUTHK9OE ride -,Transportation
manual entrry silverline group product sale,Income
Business Travel Bus Pass From Train Station,Transportation
bank network sale card affiliate product,Income
subscription lighthouse solutions team license,Software
marketplace seller - retail purchase - batch E36HTF4P,Shopping
MISC SUPPLIES AT COBALT GROUP BANK CARD,Shopping
bank ink Hub cartridges Claerview card,Office Supplies
printer room printer paper from redwood hub,Office Supplies
mobile pay for breakfast meeting mar,Food & Dining
gas utility charge at internet provider refund,Utilities
Working Lunch With Client Card 921Vf,Food & Dining
bluebird mobile pay space mar commercial llc,Rent
SOLID OAK SOLUTIONS CARD PURCHASE SUITE CHARGE,Rent
partner recurring paid invoice,Income
marketplace seller - retail purchase - ref 602987,Shopping
SOLID OAK GROUP - BRAND DESIGN - REF 362859,Marketing
MANUAL ENTRY RIVERSTONE SOLUTIONS IT SUPPORT,Professional Services
Uber - train ticket - card 58OHCU,Transportation
COBALT SYSTEMS CLIENT MAY POS COMMUTE,Transportation
Brightline Systems Ach Client Payment,Income
pro account developer tool from Solid Oak Partners,Software
Solid Oak Solutions Facility Rent Due Today,Rent
Metro Market online payment expert review,Professional Services
harbor marekt card purchase general purchase,Shopping
subscription spport contract,Professional Services
Mar Commercial Space Transfer,Rent
oct accounting services card purchase,Professional Services
Riverstone Solutions - service chargee - batch H2FF2ZV,Utilities
Toll Authority Parking Fee May Recurring,Transportation
invoice for commercial space apr,Rent
train fill visit gas up station client,Transportation
client materials store pickup from metro co,Shopping
client commute at Clearview Solutions POS,Transportation
Mailchimp Lead Generation Mo Ad Spend,Marketing
REDWOOD CO - IT SUPPORT - CARD 764549,Professional Services
refund for replacement parts jan,Shopping
Phone Company Electrric Bill Service Period,Utilities
design invoice client project order 66861,Professional Services
feb manual coffee entry,Food & Dining
pizza client dinner place jan mobile pay,Food & Dining
METRO HUB accounting services mo retainer,Professional Services
solid oak market mobile pay metered usage,Utilities
compliance fee fee advisor professional consulting,Professional Services
card purchase general supplyy,Shopping
Silverline Hub Commission Earned Jan Mobile Pay,Income
ink warehouse desk front paper printer,Office Supplies
refund from utiility provider,Utilities
Airport Parknig - Client Commute - Txn 871713,Transportation
april payment office lease from business centerr,Rent
subs google workspace productivity app,Software
local replacement card parts - store XKXWD -,Shopping
SOLID OAK MARKET - team license - ref MLGN7F,Software
transfer partner deposit received,Income
card Summit stand monitor purchase Hub,Office Supplies
sub for picup trash jun,Utilities
inv Best store pickup Buy,Shopping
taxi auth 584533 business ride travel,Transportation
mobile software may for subscription pay,Software
mobile nov for fill up gas pay,Transportation
electric automatic ref debit 2N3V bill,Utilities
sponsorship platform PPC campaign nov invoice,Marketing
Lyft toll payment jan recurring,Transportation
Incoming Transfer Deposit Received From Affiliate Network,Income
accounting invoice project RU4MH9 card services,Professional Services
launch shop brand from print design promo,Marketing
accounting firm card purchase project inv,Professional Services
PARKING GARAGE PARKING FEE LATE PICKUP,Transportation
Feb Delivery Meal Pos,Food & Dining
BROADBAND PROVIDER BROADBAND BILL ACCOUNT PAYMENT,Utilities
refund cleaning notebooks supplier,Office Supplies
trash service water bill feb card purchase,Utilities
project milestone payment customer paid order 836480,Income
exxon pos downtown,Transportation
jan advisor fee subs,Professional Services
consulting income customer paid auth 999385,Income
Pens And Pencils At Desk Store Pos,Office Supplies
Riverstone Group - bus pass - inv XNN861P,Transportation
cobalt svcs productivity app feb ACH,Software
Redwood batch - - Market 774514 advisor fee,Professional Services
metro partners catering order after sales call,Food & Dining
suite payment svcs Atlas chharge rent from,Rent
Product Sale At Wholesale Buyer Transfer,Income
project invoice consulting fee from web developer,Professional Services
Microsoft 365 card purchase seat renewal,Software
audience test ppc campgn from lighthouse llc,Marketing
retainer cliennt product sale client paymt,Income
ACH Figma developer tool,Software
Storaeg Unit Rent Lease Invoice Batch 236503,Rent
local cafe - client dinner - order F9AIZH5P,Food & Dining
bulk order for office setup auth rlexdw6l,Shopping
bus pass client visit order 445410,Transportation
Uber client commute to meeting,Transportation
payroll provider accounting services monthly retainer,Professional Services
cbalt co software subscription team upgrade,Software
Transfer Target Store Pickup,Shopping
Affiliate Network Card Purchase Customer Paid,Income
MANUAL AND VENDOR PAPER ENTRY PENS PENCILS,Office Supplies
sponsorship platform content marketing oct transfer,Marketing
jun internet transfer service,Utilities
bluebird hub sub general purchase,Shopping
furniture outlet cleaning supplies dec ACH,Office Supplies
POS SILVERLINE LLC CLOUD BILL,Software
HARBOR GROUP developer tool workspace billing,Software
Trash Pickup At Mobile Carrier Card Purchase,Utilities
Marketplace Seller Checkout Stock Up,Shopping
transfer acconut from customer,Income
manual entry stationery shop toner refill,Office Supplies
Office Depot ink cartridges may manual entry,Office Supplies
revenue deposit subscription revenue from stripe payout,Income
POS cafe charge wait during airport,Food & Dining
taxi service train ticket client viist,Transportation
linkedin ads content marketing jan refund,Marketing
Jan Mobile Product Sale Pay,Income
card purchase silverline group sw sub,Software
TRANSFERR FOR MONTHLY SPACE,Rent
Transfer Ikea Bulk Order,Shopping
SUBSCRIPTION SUPPPORT CONTRACT,Professional Services
Transfer Financial Advisor Compliance Review,Professional Services
Ppc Campaign At Evergreen Solutions Card Pucrhase,Marketing
REFUUND DEPOSIT FOR CATERING,Food & Dining
online payment retainer monthly payout income marketplace,Income
eBay checkout client materials,Shopping
advisor fee monthly retainer auth A78516,Professional Services
solid oak group recurring support contract,Professional Services
power service trash pickup mar subs,Utilities
paid meta invoice campaign,Marketing
Slack mobile pay team upgrade,Software
STAFF FROM VENDOR SUPPLIES CLEANING SUPPLIES PAPER,Office Supplies
REFUND PLAN PHONE SEP FOR,Utilities
SUMMIT CO cloud bill cloud usage,Software
Jun Coworking Rent Sub,Rent
BANK SNACKS CARD FOR APR OFFICE,Food & Dining
service revenue deposit order 281506 revenue,Income
WATER BILL LATE FEE INCLUDED BATCH ZAZYXW1C,Utilities
coworking space monthly lease april payment,Rent
Office Snacks At Bakery Refund,Food & Dining
SUMMIT SYSTEMS monthly plan charge hosting,Software
Home Setup Bulk For Order Depot Office,Shopping
refund catering deposit for,Food & Dining
pens and pencils at LIGHTHOUSE SEERVICES invoice,Office Supplies
staff event catering order from clearview systems,Food & Dining
recurring for notebooks feb,Office Supplies
