description,category
equipment supplier monitor stand mar manual entry,Office Supplies
subscription workspace renewal,Software
SOLID OAK MARKET - train ticket - inv 385479,Transportation
Manual Entry Sponsor Subscription Revenue,Income
NORTHSTAR CO INVOICE EXPERT REVIEW,Professional Services
coworking space online paymt space rental,Rent
staff supplies office chairs from cleaning supplier,Office Supplies
adobe team license jun online payment,Software
refund may rent for office,Rent
ACH accounting services dec for,Professional Services
downtown bus pass from toll authority,Transportation
Lyft Invoice Busness Travel,Transportation
clearview retainer income monthly deposit hub revenue,Income
team order 720367 workspace license billing,Software
CARD PURCHASE PARTS BUY REPLACEMENT BEST,Shopping
Pos For Service Chare Dec,Utilities
printer paper admin area auth 868650,Office Supplies
subscription for bulk order nov,Shopping
ikea electronics may manual entry,Shopping
priner paper from Bluebird Llc printer room,Office Supplies
BULK ORDER AT ATLAS PARTNERS INVOICE,Shopping
saas renewal at lighthouse systems subscription,Software
OCT PURCHASE CARD LUNCH TEAM,Food & Dining
expert review compliance review from Evergreen Hub,Professional Services
Bluebird Systems consulting income revenue deposit,Income
marketplace seller bulk order small equipment,Shopping
downtown bus pass from taxi service,Transportation
workspace billing SaaS renewal from GitHub,Software
client commute at airport parking bank card,Transportation
Refund For Subscription Revenue Feb,Income
clou bill recurring quickbooks at,Software
pos agency flyer printing seo,Marketing
Online Payment Riverstone Services Office Chairs,Office Supplies
LAUNCH PROMO CONTENT MARKETING FROM MAILCHIMP,Marketing
during travel day breakfast meeting from SILVERLINE SOLUTIONS,Food & Dining
trah service water bill may bank card,Utilities
TEAM LUNCH AT COFFEE SHOP SUB,Food & Dining
Affiliate Network Subscription Revenue Client Payment,Income
tax preparer review payroll service expert,Professional Services
card purcahse admin supplies,Office Supplies
online Amazon transfer order at,Shopping
transfer monthly for space,Rent
pro account software subscription from vercel,Software
recurring for service charge mar,Utilities
wholesale buyer mo retainer income revenue deposit,Income
metro solutions - commercial space - inv yvf3t,Rent
IKEA bulk order general purchase,Shopping
bank card for trash pickup jan,Utilities
bank and pens card oct for pencils,Office Supplies
rental property monthly lease mar mobile pay,Rent
northstar campaign invioce hub recurring,Marketing
printer paper at printer supplier invoice,Office Supplies
transfer for client commute oct,Transportation
trade show flyer printing dec recurring,Marketing
deposit customer received paid 113882 batch,Income
marketpace payout consulting income client payment,Income
ACH for cloud bill jun,Software
pos hubspot brand design,Marketing
notebooks at cleaning supplier mobile pay,Office Supplies
stationery cleaning may supplies shop invoice,Office Supplies
clearview 595129 - - auth milestone project solutions paymt,Income
hubspot promo paid promotion launch,Marketing
manual entry for toll payment apr,Transportation
airpotr parking train ticket client visit,Transportation
GAS COMPANY PHONE PLAN JAN SUBSCRIPTION,Utilities
restaurant working lunch during travel day,Food & Dining
feb coworking rent card purchase,Rent
pizza place invoice meeting late,Food & Dining
apr commercial space refund,Rent
nov card tool purchase developer,Software
Adobe - Hosting Charge - Ref 0Dxoah,Software
ach sep payroll service for,Professional Services
May Sub Revenue Bank Card,Income
manual desk pass entry bus car retal,Transportation
Refund For Trash Pikcup Dec,Utilities
SUMMIT pay mobile PARTNERS paper printer sep,Office Supplies
brihgtline market working lunch staff event,Food & Dining
Riverstone Systems - Service Charge - Batch 218161,Utilities
jan storage unit rent subscription,Rent
Instagram social media ads feb mobile pay,Marketing
dec rent pos faclity,Rent
METRO ORDER PARTNERS - SUPPLIES IEDD0 - MISC,Shopping
Mobile Pay For Software Subscription Jan,Software
colud usage SaaS renewal from bluebird llc,Software
Refund For Commercial Space Sep,Rent
SEP CONTENT MARKETING REFUND,Marketing
Electric Bill Service Period Batch 885990,Utilities
mobile purchase debit card automatic carrier,Utilities
catering ordre at restaurant online payment,Food & Dining
cllient invoice payment received,Income
recurring app Microsoft 365 productivity,Software
BLUEBIRD HUB onlnie payment mo plan,Software
PROFESSIONAL FEE CONSULTING FEE FROM REDWOOD PARTNERS,Professional Services
jun content marketing online payment,Marketing
onlien payment Staples notebooks,Office Supplies
Sep Taxi Moobile Ride Pay,Transportation
metro market monthly lease suite charge,Rent
mar office snacks refund,Food & Dining
POS for email marketing feb,Marketing
Financial Fee Advisor May Consulting Pos,Professional Services
transfer for utility payment apr,Utilities
Revenue Deposit Service Revenue From Wholesale Buyer,Income
warehouse owner - commercial space - txn 798812,Rent
airport parking garage from ticket trip train,Transportation
bank card for notebooks oct,Office Supplies
evergreen it support systems card 61p3 - -,Professional Services
Payroll Service At Freelance Designre Recurring,Professional Services
Monthly Bill Aws Cloud,Software
Metro Services Office Chairs Mar Subscription,Office Supplies
Noion developer tool oct ACH,Software
dec refund campgn PPC,Marketing
developer tool workspace billing card 671788,Software
recurring for jun tax preparation,Professional Services
may design inv recurring,Professional Services
deposit received at redwood llc invoice,Income
TRANSFER FOR MOTHLY SPACE,Rent
INSTAGRAM FLYER PRINTING NOV ONLINE PAYMENT,Marketing
client project invoice Solid Oak design Services from,Professional Services
Solid Oak Services Compliance Review Sep Online Pmt,Professional Services
Facebook monthly ad spend ads campaign Ads,Marketing
Pos For Deposiit Received Nov,Income
Monthly Office Bill Trash Pickup From Harbor Market,Utilities
Affiliate Pos Revenue Network Service Jan,Income
feb POS parking fee,Transportation
SMALL EQUIPMENT CHECKOUT FROM ATLAS LLC,Shopping
bank card for cloud bill nov,Software
ach for coffee jan,Food & Dining
eBay for setup transfer offce,Shopping
Client Visti Parking Fee From Evergreen Llc,Transportation
lighthouse card group purchase client pmt,Income
Lighthouse Group hosting charge monthly plan,Software
refund atlas hub checkout,Shopping
invoice solid oak partners hosting charge,Software
nov SaaS renewal subscription,Software
mobile pay SOLID OAK LLC office chairs,Office Supplies
recurring for electronics oct,Shopping
card purchase general supplies,Shopping
refund wholesale buyer service revenue,Income
refreshments at BLUEBIRD svcs refund,Food & Dining
notion upgrade software crm team,Software
warehouse owner storage unit rent feb refund,Rent
dec refreshments mobile pay,Food & Dining
TAX PREPARER - ADVISOR FEE - REF GZTZ1DS,Professional Services
professional fee legal consultation from compliance advisor,Professional Services
evergreen co sub paid invoice,Income
dec coffee card purchase,Food & Dining
stationery shop notebooks supply cabinet,Office Supplies
QuickBooks CRM A0WUOWJ0 - - software order,Software
card prchase at station kiosk,Transportation
gas company transfer late fee included,Utilities
print shop - ads campgn - card CWHMRI,Marketing
misc supplies at SOLID OAK PARTNERS ACH,Shopping
REDWOOD SERVICES WAREHUOSE RENT APR MOBILE PAY,Rent
Cobalt promotion audience test paid Hub,Marketing
card purchase business consultant compliance review,Professional Services
Sub Partner Project Milestone Payment,Income
rent paymetn lease invoice card 228970,Rent
business oct fee consultant online advisor paymt,Professional Services
team from Figmma software upgrade subscription,Software
Sponsorship Platform Brand Designn Apr Pos,Marketing
staff event breakfast meeting from evergreen market,Food & Dining
Clearview payment during travel day Partners online,Food & Dining
jan parking fee recurring,Transportation
sewr utility - phone plan - auth S44Z78,Utilities
SILVERLINE MARKET NOTEBOOKS SUPPLY CABINET,Office Supplies
misc supplies at ikea online payment,Shopping
stripe payout transfer incoming transfer,Income
feb preparaion pos tax,Professional Services
commission invoice earned paid i1g9o txn,Income
mar notebooks refnd,Office Supplies
Product Sale Client Pmt Card Ao0Fd51,Income
card purchase elecric company utility pmt,Utilities
QuickBooks CRM software seat renewal,Software
invoice bill cloud for nov,Software
LIGHHTHOUSE HUB transfer monthly plan,Software
lease payment from owner invoice warehouse rent,Rent
Professional Bluebird Legal From Consultation Fee Hub,Professional Services
Dec Airport Ride Card Purchase,Transportation
general parts clearview purchase from svcs replacement,Shopping
PROJECT MILESTONE PAYMENT SETTLEMENT BATCH REF 43982,Income
sep bulk order transfer,Shopping
shell airport ride apr card purchase,Transportation
IKEA - retail purchase - card GUCZH9,Shopping
bank card for traain ticket jan,Transportation
water bill office 490299 card bill monthly,Utilities
JAN INCOME CONSULTING SUBSCRIPTION,Income
affiliate batch commission network - - 686663 earned,Income
metro group manual entry general purchase,Shopping
oct compliance review card purchase,Professional Services
working batch 380987 for team meeting lunch,Food & Dining
subscription print shop campgn ppc,Marketing
software subsrciption seat renewal card HDEK,Software
may transfer email marketing,Marketing
ink warehouse office chairs nov refund,Office Supplies
summt solutions - subscription revenue - inv 78003,Income
sewer utility transfer metered usage,Utilities
monitor stand at NORTHSTAR SOLUTIONS refund,Office Supplies
OCT AIRPORT RIDE CARD PURCHASE,Transportation
lighthouse pass - - bus auth 710217 market,Transportation
breakfast meeting staff event txn 262199,Food & Dining
SILVERLINE LLC TRANSFER LATE PICKUP,Transportation
refund solutions northstar ride taxi,Transportation
dec client commute mobile pay,Transportation
manual jun for lunch entry team,Food & Dining
dec gas fill up subscription,Transportation
Staff Supplies From Coobalt Cartridges Ink Services,Office Supplies
ACH for retail purchase feb,Shopping
client project CLEARVIEW LLC from fee advisor,Professional Services
CLEARVIEW HUB monthly lease nov ACH,Rent
monthly retainer income at marketplace payout online payment,Income
Hosting Charge Monthly Plan Inv 172530,Software
Walmat checkout quick run,Shopping
refund from utility provider,Utilities
partner - project milestone payment - order 724466,Income
airport CPL72U inv trip ride airport,Transportation
recurring fiber provider electric bill,Utilities
AWS - CRM software - order 761039,Software
ads campaign launch promo txn 954088,Marketing
desk accessories staff supplies inv Y9K34,Office Supplies
POS for ofice lease sep,Rent
refreshments at restaurant bank card,Food & Dining
github - saas renewal - txn 3105944,Software
account payment phoen plan from trash service,Utilities
tax preparation at web developer manual entry,Professional Services
redwood systems refund audience test,Marketing
APRIL UNIT STORAGE METRO FROM PAYMENT PARTNERS RENT,Rent
sponsor received - payment ref iby4z3k1 - invoice,Income
Microsoft entry manual monthly 365 plan,Software
airport ride GROUP SILVERLINE at recurring,Transportation
LinkedIn Ads - flyer printing - batch BFO8X8,Marketing
sw subscription at quickbooks card purchase,Software
office snacks at deli counter online payment,Food & Dining
Doordash - Breakfast Meeting - Txn 150522,Food & Dining
METRO SOLUTIONS storage unit rent mar online paymentt,Rent
ONLINE PAYMENT FOR TRASSH PICKUP DEC,Utilities
late meeting meal delivery from atlas solutions,Food & Dining
CATERING SALES COMPANY MEAL AFTER CALL DELIVERY,Food & Dining
client invoice payment received,Income
google ads spend ad monthly campaign ads,Marketing
Manual Entry For Service Revenue Mar,Income
metered from Llc usage Summit bill electric,Utilities
manual entry GitHub team license,Software
MAR ONLINE ORDER ONLINE PAYMENT,Shopping
Cobalt Co - office lease - batch 789470,Rent
storage rent payment office april facility,Rent
invoiice for advisory review,Professional Services
google ads email marketing jan recurring,Marketing
Online Payment For Ink Cartridges May,Office Supplies
BLUEBIRD GROUP POS mar catering order,Food & Dining
revenue paymt payout inv stripe deposit received from,Income
invoice company bill electric phone,Utilities
transfer service payroll nov for,Professional Services
lighthouse hub - advisor fee - inv 155583,Professional Services
paid ACH promotion LIGHTHOUSE PARTNERS at,Marketing
mar content marketing POS,Marketing
Mar Purchase Retail Recurring,Shopping
riverstoen services cleaning supplies apr transfer,Office Supplies
Customer Paid Monthly Retainer Income From Sponsor,Income
invoice phone for plan nov,Utilities
late meeting refreshments from uber eats,Food & Dining
monthly ad sped email marketing from LinkedIn Ads,Marketing
coworking - rent coworking 157923 space - txn,Rent
recurring for developer tool sep,Software
legal consultation client project ref 147238,Professional Services
dec coffee ach,Food & Dining
office refund lease may monthly landlord,Rent
online payment Dropbox team license,Software
client dinner late meeting txn 611150,Food & Dining
Instagram brand design launch promo,Marketing
Utiliity Paymt At Atlas Llc Pos,Utilities
pens and pencils printer room card 964211,Office Supplies
card general supplies purchase,Shopping
Metro Station Manual Entry To Meeting,Transportation
dec team lunch refund,Food & Dining
service from trash OAK MARET period pickup SOLID,Utilities
POS for utility payment feb,Utilities
Subscription For May Furniture,Shopping
saas renewal at drropbox mobile pay,Software
GENERAL PURCHASE FURNITURE FROM SILVERLINE HUB,Shopping
harbor day travel coffee market during,Food & Dining
CLIENT MATERIALS RETAIL PURCHASE FROM BEST BUY,Shopping
metro llc ach airport trip,Transportation
local cafe - refreshments - order 118320,Food & Dining
Downtownn Bus Pass From Lyft,Transportation
ink cartridges supply cabinet ref BL4OVD3,Office Supplies
card purchase general spuply,Shopping
BUSINESS PAYMT PAYMENT CENTER ONLINE APRIL,Rent
IKEA client materials misc supplies,Shopping
supply cabinet printer paper from furniture outlet,Office Supplies
equipment desk accesories txn - - supplier 960168,Office Supplies
REFUND EVERGREEN SOLUTIONS CLIENT COMMUTE,Transportation
pens and pencils at bluebird hub ACH,Office Supplies
rental car desk taxi ride business travell,Transportation
bank card for desk accessories mar,Office Supplies
catering ordr at local cafe recurring,Food & Dining
harbor meeting bank card for group team,Food & Dining
Cobalt Llc Pos During Travel Day,Food & Dining
Online For Developer Tool Oct Payment,Software
VERCEL - TEAM LICENSE - BATCH 502823,Software
Manual Cobalt Received Llc Invoice Payment Entry,Income
bank card pens and apr for pencils,Office Supplies
atlas hub - toll payment - card 124480,Transportation
PARKING FEE CLIENT VISIT AUTH 617940,Transportation
Office Depot Pens And Pencils Staff Supplies,Office Supplies
IKEA misc supplies for office setup,Shopping
client materials retail purchase from Solid Oak Group,Shopping
bulk order at Walmart card purchase,Shopping
invoice monthly dec lease for,Rent
subscription restaurant refreshments,Food & Dining
transfer Silverline Llc ink cartridges,Office Supplies
online Partners ads Riverstone campaign payment,Marketing
partner invoice invoice paid,Income
summit group email marketing dec mobile pay,Marketing
SUMMIT LLC water bill feb ACH,Utilities
SUMMIT SYSTEMS CONTENT MARKETIG OCT SUBSCRIPTION,Marketing
MOBILE PAY EVERGREEN SVC CLOUD BILL,Software
STAFF SUPPLIES DESK ACCESSORIES FROM DESK STORE,Office Supplies
bank card for compliance review mar,Professional Services
parking office space due rent owner today,Rent
Tax - Prepparer - Invoice 986711 Card Design,Professional Services
subscription Meta campaign PPC,Marketing
tax preparer card purchase client project,Professional Services
suummit svcs - fee txn advisor - 6D56,Professional Services
compliance review at silverline partners invoice,Professional Services
transfer for project milestone payment dec,Income
Bank Desk Northstar Card Market Accessories,Office Supplies
marketplace payout deposit received settlement batch,Income
online paymt mobile carrier service charge,Utilities
Amazon POS client materials,Shopping
furniture at Etsy subscription,Shopping
working D8WACEQ with auth lunch client,Food & Dining
retargeting paid promotion from trade show,Marketing
subscription reveenue 869213 transfer incoming auth,Income
airport parking client commute dec recurring,Transportation
mo ad spend ads campaign from NORTHSTAR MARKET,Marketing
transfer for cleaning supplies apr,Office Supplies
Northstar Hub Subscription Revennue Sep Card Purchase,Income
subscription northstar market airport ride,Transportation
account payment service charge from electric company,Utilities
Solid Oak Llc Client Commute Dec Subscription,Transportation
recurring coworking Silverline Co rent,Rent
online fill nov up payment gas for,Transportation
Gas Recurring Automatic Company Debit,Utilities
recurring for client commute feb,Transportation
ATLAS developer upgrade tool GROUP team,Software
trash gas company pickup ach at,Utilities
metered usag water bill from internet provider,Utilities
transfer office SUMMIT rent LLC,Rent
transfer for monthly sace,Rent
card purchase EVVERGREEN MARKET checkout,Shopping
toll - payment - batch toll authority 212775,Transportation
Commercial At Co Invoice Space Riverstone,Rent
sep catering refund order,Food & Dining
Campaign Google Ads From Ads Social Invoice Medai,Marketing
phone company water bill apr mobile pay,Utilities
online payment Lyft toll payment,Transportation
REFUND PAYOUT FROM MARKETPLACEE SALE,Income
figma bank card cloud usage,Software
CUSTOMER SUBSCRIPTION REVENUE INCOMING TRANSFER,Income
bus pass downtown batch 443276,Transportation
taxi to entry meeting manual service,Transportation
refreshments at Uber Eats transfer,Food & Dining
coffee with client txn 36004,Food & Dining
SEO agency launch promo payment online,Marketing
ZOOM ONLINE SUBS SOFTWARE FEB PAYMNET,Software
transfer for mnthly space,Rent
MO AWS CLOUD BILL,Software
online pmt for team seats,Software
parking space owner commercial space lease invoice,Rent
equipment supplier monitor stand staff suppplies,Office Supplies
monthly retainer payroll service from IT support,Professional Services
target 68557 - order electronics -,Shopping
transfer post for sponsored,Marketing
toll payment airport trip ref 652586,Transportation
Doordash Refreshments Nov Transfer,Food & Dining
Northstar Co coffee feb transfer,Food & Dining
restaurant meeting mar breakfast manual entry,Food & Dining
flyer prniting retargeting order sbyi4,Marketing
atlas llc - store pickup - auth 70986,Shopping
Monthly Lease At Sorage Facility Subscription,Rent
sep tax preparation invoice,Professional Services
service silverline bill period servicess broadband from,Utilities
Clearview Group ink cartridges jan recurring,Office Supplies
recurring coffee shop catering order,Food & Dining
Facebook Ads mobile pay retargeting,Marketing
financial advisor payroll service pro fee,Professional Services
toll authority rental car to meeting,Transportation
invoice lighthouse systems design invoice,Professional Services
office snacks late meeting card 00IV1GGG,Food & Dining
Lcal Cafe Transfer Late Meeting,Food & Dining
Atlas Market lead genration nov invoice,Marketing
cobalt co catering ordeer with client,Food & Dining
oct warehouse rent pos,Rent
META POS RETARGETING,Marketing
crm software pro account card 40967,Software
subscription costco online order,Shopping
online pmt silverline solutions team licennse,Software
notebooks printer room txn BEBSYL,Office Supplies
bank card cleaning supplier office chairs,Office Supplies
bluebird systems airport ride feb online payment,Transportation
deposit received customer paid inv 18597,Income
jan office rent bank card,Rent
online payment Meta brand design,Marketing
Riverstone Market Meal Delivery After Salles Call,Food & Dining
gas utility charge at mobile carrier mobile pay,Utilities
Invoice For Broadband Bill Sep,Utilities
team lunch at silverline systems ACH,Food & Dining
lead oak POS at generation partners solid,Marketing
bank card for water bill jan,Utilities
electric mobile pay plan oct phone company,Utilities
paper vendor - pens and pencils - ref 33mu,Office Supplies
online for internet service paymt jan,Utilities
dec paid promotion subscription,Marketing
transfer legal to consultant,Professional Services
Dec Service Revenue Invoice,Income
dec consulting fee subscription,Professional Services
front furniture outlet ink desk from cartridges,Office Supplies
DUE TODAY FROM PROPERTY RENT RENTAL PMT,Rent
offfice chairs staff supplies batch 45046,Office Supplies
desk accessories at lighthouse group refund,Office Supplies
BLUEBIRD GROUP SaaS renewal may manual entry,Software
stpales refill admin area toner,Office Supplies
sub for social media ads mar,Marketing
Invoice Retainer Client Consulting Income,Income
Bulk Best At Order Transfer Buy,Shopping
invoice business center rent paymt,Rent
Recurring Silverline Hub Meal Delivery,Food & Dining
cloud usage developer tool from Clearview Hub,Software
Northstar Charge Utility Usage Co Metered Gas,Utilities
broadband bill at bluebird solutions refund,Utilities
tax prreparer subscription expert review,Professional Services
oct online payment broadband bill,Utilities
mobile pay evergreen systems storage unit rent,Rent
Recurring Lunch Apr For Working,Food & Dining
sponsorship platform PPC campgn jan subscription,Marketing
recurring tool Microsoft 365 design,Software
SUBSCRIPTION BATCH 325934 PAID REVENUE CUSTOMER,Income
gas company service charge service period,Utilities
stripe payout recurring paid invoice,Income
brand design sponsored post batch RJD1X4N6,Marketing
trin station POS late pickup,Transportation
mo ad spend email marketing from sponsorship platform,Marketing
web developer accounting svcs dec manual entry,Professional Services
apr refund invoice design,Professional Services
printer paper supply cabinet auth 458554,Office Supplies
sponsorship media ads social 7nx4 ref - platform -,Marketing
manual entry for commission earned mar,Income
parking space owner manual entry space rental,Rent
SaaS renewal at silverline hub recurring,Software
law firm advisor fee monthly retainer,Professional Services
POS parking space owner commercial space,Rent
service preiod gas utility charge from broadband provider,Utilities
ETSY BULK ORDER QUICK RUN,Shopping
feb design tool ACH,Software
transfer to legal consultant,Professional Services
REDWOOD PARTNERS - content marketing - ref 16648,Marketing
card purchase solid oak group service revenue,Income
commercial lease lease ACH invoice,Rent
CLEARVIEW SYSTEMS card purchase monthly plan,Software
software subscription monthly plan inv 274723,Software
recurring for cloud bill feb,Software
jan payment manual rent entry,Rent
online for payment parts replacement,Shopping
Developer At Tool Pos Aws,Software
mobile pay for dec campaign ppc,Marketing
Apri Payment Coworking Rent From Warehouse Owner,Rent
manual entry for payroll service mar,Professional Services
lighthouse project invoicce hub invoice,Professional Services
CONSULTING FEE EXPERT REVIEW CARD 566658,Professional Services
Feb Rent Paymt Subscription,Rent
deli counter working lunch sep online payment,Food & Dining
invoiec for breakfast meeting nov,Food & Dining
late pickup client commute from parking garage,Transportation
ACH for office chairs apr,Office Supplies
Clearview team subscription software Co upgrade,Software
Zoom design tool jun transfer,Software
summit hub - ink cartridges - batch 510136,Office Supplies
Online Pmt For Clent Commute Mar,Transportation
cobalt solutions - misc supplies - txn 138148,Shopping
office landlord recurring monthly payment,Rent
airport trip rental car from cobalt group,Transportation
Northstar Partners Mannual Entry Printer Room,Office Supplies
oct team lunch ACH,Food & Dining
transfer for IT support jan,Professional Services
marketplace ref payout - consulting income - hkftvzcf,Income
phone company gas utility charge nov ACH,Utilities
Productivity App Cloud Usage Auth 464224,Software
launch promo flyer printing from HARBOR SOLUTIONS,Marketing
local cafe team lunch nov pos,Food & Dining
furniture front outlet desk chairs office,Office Supplies
downtown train from ticket metro station,Transportation
ONLINE HUB IT SUPPORT OAK SOLID PAYMENT,Professional Services
card purchase bluebird hub office chairs,Office Supplies
BAKERY - BREAKFAST MEETING - REF YGTMOV6K,Food & Dining
Tax Preparation At Summit Services Pos,Professional Services
jan software subscription ACH,Software
Brightline Market Developer Tool Jun Bank Card,Software
Fiber Provider Gas Utility Charge Dec Ach,Utilities
online paymt for replacement parts,Shopping
inv incoming manual transfer portal etnry,Income
recurring Silverline Llc office rent,Rent
power service utility payment nov refud,Utilities
rcurring for social media ads nov,Marketing
RENT PAYMENT LEASE INVOICE ORDERR BRAY,Rent
refund payout from marketplace sale,Income
HR consultant adivsor fee jan subscription,Professional Services
summit pay meeting partners to mobile,Transportation
mobile utility payment pmt account carrier,Utilities
Google Ads - Ads Campaign - Batch Zvow,Marketing
invoicce from property account,Rent
NOV OFFICE RENT MANUUAL ENTRY,Rent
bus pass at Solid Oak Partners card purchase,Transportation
jan meal delivery ach,Food & Dining
SEO agency ads campaign oct ACH,Marketing
studio landlord rent payment may invoice,Rent
